{
  "id": "6c99ecbe-b6fa-4dcf-a98c-87181c794f02",
  "conversation_type": "direct",
  "lifecycle_state": "active",
  "node_id": null,
  "node_id_snapshot": null,
  "node_title_snapshot": null,
  "visibility": "participants",
  "created_at": "2026-07-30T12:00:00Z",
  "updated_at": "2026-07-30T12:00:00Z",
  "archived_at": null,
  "deleted_at": null
}
