{
  "id": "b9d43c7a-6d44-4a0f-a4ec-0b1c2bb4d736",
  "conversation_type": "node",
  "lifecycle_state": "archived",
  "node_id": null,
  "node_id_snapshot": "node-archived-example",
  "node_title_snapshot": "Archivierter Beispielknoten",
  "visibility": "public",
  "created_at": "2026-07-27T09:00:00Z",
  "updated_at": "2026-07-27T09:05:00Z",
  "archived_at": "2026-07-27T09:05:00Z",
  "deleted_at": null
}
