{
  "id": "7982eb13-53d0-47af-86d9-22b438f9d6c8",
  "conversation_type": "governance_proposal",
  "lifecycle_state": "active",
  "node_id": null,
  "node_id_snapshot": null,
  "node_title_snapshot": null,
  "visibility": "public",
  "created_at": "2026-07-27T10:00:00Z",
  "updated_at": "2026-07-27T10:00:00Z",
  "archived_at": null,
  "deleted_at": null
}
