{
  "id": "d3a6c9b1-8c4f-4e6b-a02a-2c9d6a5b6c3a",
  "conversation_type": "node",
  "lifecycle_state": "active",
  "node_id": "node-hamburg-commons",
  "node_id_snapshot": null,
  "node_title_snapshot": null,
  "visibility": "public",
  "created_at": "2024-02-10T09:00:00Z",
  "updated_at": "2024-02-10T09:00:00Z",
  "archived_at": null,
  "deleted_at": null
}
